2010/10/25 10:17:40,Descansando un rato. Manana ya empieza el lío. Salimos para LA a abrir la temporada... Estoy ansioso
2010/10/25 10:20:10,A little relax at home... The little one are sleeping and I'm ready for this season to start. I'm anxious. Tomorrow we flight to LA.
2010/10/25 12:09:41,"Aca Va una foto de Lucas, para Los que pidieron // here is a pic of little Lucas. For those who asked  http://plixi.com/p/52765999"
2010/10/25 10:39:59,A friend of mine always let me uses hers RT @TraceyNBA: @LScola4 Pack your phone charger! :-)
2010/10/26 12:18:12,RT @TopNBATweeter: I'm voting for @LScola4 in the Top #NBA #Twitter #Celebrities Poll! http://votejet.com/Py0U8qd97b
2010/10/26 10:01:15,"Ya estoy en territorio enemigo! Una buena cena y a dormir // At ""enemy territory"", now a nice dinner and sleep for the game. Another season!"
2010/10/26 09:53:35,"jaja RT Ah! Pensé q reproductivamente! Je RT @JulianMozo: Brooks sobre @lscola4: ""Es nuestro conejito de Energizer"""
2010/11/02 12:41:42,My direcTV broke right when I was about to watch Tiago's first minutes! I'm so angry! How did he do?
2010/11/02 13:36:34,"Uh. Estuviste durisimo... ""@manuginobili: @LScola4 Creo q ya te igualó en cantidad de volcadas en la NBA! Jeje."""
2010/11/06 03:14:25,"No solo que voy, sino que puede que venga un invitado sorpresa. ;-)   ""@manuginobili:Mañana contra los Rockets.Nos dejará @LScola4 n banda"""
2010/11/05 09:09:35,I'm in shock for Oberto's news! One of the top argentinian athletes of the history. Playing with him was a pleasure. Thanks for all fabri
2010/11/06 05:18:00,"Jaja,y mira que somos distintos,eh!""@sotomartinsoto: Diario salteño confundió a @LScola4 con @obricio7  #FAIL #basquet http://bit.ly/d4qcpO"""
2010/11/06 11:50:30,Que buena cena! // what a fun dinner with my friends! Now rest for tomorrow http://twitpic.com/34adut
2010/11/07 06:23:01,"Though place to try to get the first win, but we have to go for it// dificil cancha para romper la racha, pero no queda otra!"
2010/11/06 12:02:17,"Salimos corriendo! Ja ""@tgaude: @LScola4 quien paga?? Dios? cc @manuginobili @tiagosplitter @obricio7"""
2010/11/10 07:12:42,"De gira por el este! A ver si toca una racha positiva// to the East for 3 games, lets see if we can come back with a decent record (4-5?)"
2010/11/10 07:08:51,Linda columna acerca de Fabricio http://bit.ly/dvDzpV // nice article about Fabri Oberto (in spanish)
2010/11/11 13:39:52,"Tenemos que cortar esta racha ya!, recién llegamos a Indiana, ahora a descansar y a preparar el partidos, lo necesitamos!!"
2010/11/11 13:38:58,"we need to turn this thing around now... just got to Indiana, now sleep and get ready for the game, we need it!"
2010/11/14 06:35:12,"Acabo de llegar a Manhattan, New York es siempre algo especial, mi ciudad favorita acá en Usa"
2010/11/14 07:47:43,"Tied with houston ;-)""@Patacones:“@LScola4:We just got to Manhattan, NY it's always special, my favorite city in the US” more then Houston?"""
2010/11/13 11:03:54,"Ugly win, but we need it so bad! Now we have to back it up in NY// partido feo q ganamos, pero lo necesitabamos! Ahora a ganar en el madison"
2010/11/14 07:56:06,"Me encanta! ""@LouiSauceda: @LScola4 no te gusta houston!?"""
2010/11/14 06:33:57,"We just got to Manhattan, NY it's always special, my favorite city in the US"
2010/11/15 11:40:24,"It's looking better, we held them in 10 transition points and 6 second chance point, great job. Now we're going back home, Chicago tuesday."
2010/11/15 11:36:20,"Definitivamente! Un abrazo ;-)""@victordeblas: Con la camiseta de @LScola4, 03:44 de la noche y yo despierto viendote. Merece un saludo no?"""
2010/11/15 11:38:42,"Esto ya va queriendo, buena victoria, no los dejamos correr, Chuck secó a Amare en el segundo tiempo. Ahora volvemos a casa, contra Chicago"
2010/11/17 07:55:40,"Vamos River! Recién termino de escuchar el partido por radio, ya en el toyota center, ahora sí ganamos nosotros ya es día completo."
2010/11/18 12:27:51,"No hay caso, no arrancamos, ahora a Toronto. Oklahoma me gusta mucho. Nosotros tenemos mucho que mejorar"
2010/11/18 12:28:55,"We can't get it on. Oklahoma looks good. We got a lot of work to do, now Toronto"
2010/11/19 03:03:43,"Nuevo proyecto. Tengo mucha espectativa, espero que salga bien http://bit.ly/bhvyCp"
2010/11/19 03:25:49,"Es todo en la Universidad de Palermo, yo doy la ultima charla. ""@seriesandtv: @LScola4 Venís a Argentina o lo dictás a distancia?"""
2010/11/21 10:40:48,hubo cena entre @tiagosplitter y Varejao? habrán invitado a un Argentino a la mesa? (@manuginobili)
2010/11/25 13:00:52,"Good win!solid game overall.  Kyle it's playing awsome, i can't belive all those free throws I missed, i though those days were behind me."
2010/11/25 13:08:36,"Buena victoria, partido solido. Kyle esta jugando increible, no puedo creer todos los libres que erre, pensé que esa estapa estaba superada!"
2011/12/26 00:43:41,"Merry christmas!. The NBA is back, best christmas present ever."
2011/12/26 00:42:28,"Feliz navidad para todos, estoy viendo la previa de New York-Celtics. Pensé que este momento no llegaba nunca, ¡por fin NBA!"
2011/12/29 08:57:33,"Home opener tomorrow against old division rival, big game!"
2011/12/29 08:46:01,"Mañana abrimos la temporada en casa con un partidazo vs. nuestro viejo rival de división, los Spurs. En vivo por #nbapass."
2011/12/30 12:43:39,"Great home opener, now a back to back to back. Let's see how hard are those."
2011/12/30 12:45:18,"Buena victoria en casa. Me gustó como jugamos, intenso, concentrados... Ahora se vienen 3 partidos en 3 días. Veremos que tan duro es."
2012/01/05 08:37:37,"Guys, follow Matt Bullard, former Rocket champions and TV commentator of our games,  he just got twitter @bull50."
2012/01/05 08:41:53,"Gente, sigan a Matt Bullard(@bull50), campeón con los Rockets en el 95 y ahora comentarista de nuestros games. Tiene la posta de los Rockets"
2012/01/06 05:48:35,That's my kind of car. http://t.co/1yTEBrGB
2012/01/07 06:14:04,Thanks! RT @ManuelAranzubia: I voted to send  Luis Scola from Houston to the 2012 NBA All-Star Game. http://t.co/27xAoaYw @LScola4
2012/01/07 06:14:27,Muchas gracias!! RT @BasKetBalleros: He votado para mandar a @LScola4 de Houston al  #EneBeA 2012 All-Star Game. http://t.co/27xAoaYw
2012/01/11 05:17:03,"Another 4 games in 5 nights, starting today here at Charlotte, great chance to get back in track, tomorrow SA."
2012/01/10 08:27:02,"¡Gracias, Colo!RT @juansebastia: I voted to send  Luis Scola from Houston to the 2012 NBA All-Star Game. http://t.co/27xAoaYw"
2012/01/11 05:19:44,"Otra vez 4 partidos en 5 noches, empezando hoy en Charlotte por #nbapass, buena oportunidad para empezar a ganar. Mañana San Antonio s/Manu."
2012/01/10 11:13:34,"I'm whatching a tv special on the former NBA player Chris Herren, on espn2. What a heartbreaking story."
2012/01/11 01:10:31,"Sigan a mi compañero Terrence Williams ( @therealtwill ), que me llora porque no tiene seguidores. Está un poco loco, pero es buen pibe."
2012/01/11 05:32:55,"No, canal 675 de #nbapass RT @juanflorez: @LScola4 space pasa el partido esta noche?"
2012/01/11 01:15:24,Dice @therealtwill  que habla español (¿?)
2012/01/10 08:07:43,"Ya llegamos al hotel acá en Charlotte. Ahora me pido comida y me pongo a ver a @SoyElChapu vs. Indiana, ¡a ver si hoy juega!. #nbapass"
2012/01/15 23:57:53,"RT @Gustavo_FCO: Hoy a las falleció Jorge ""GANCHO"" Kornicki #FERRO @mariano_almada @ferrocarriloest @ferroweb// QEPD, una noticia muy triste"
2012/01/17 06:06:02,"3rd win on a row, we are almost .500. Now we go back home to play Detroit on ANOTHER back to back. Lets keep it going #Rockets"
2012/01/18 13:19:42,"Great win, we could finally have some rest, 6 games in 8 days, this looks like FIBA now! 4 in a row and .500. I ... http://t.co/dxTjw0Eu"
2012/01/18 13:21:24,"Otra victoria más y esta vez pudimos rotar más y descansar un poco. 6 partidos en 8 días, esto se está pareciendo un poco a FIBA, je."
2012/01/20 13:20:26,"Very ugly win, we play bad all game long but we stick with it and came up with the 5th win on a row. Also we move above .500. Looking good"
2012/01/24 12:08:18,"I'm going to follow @hasheemthedream now, because he is mad at me if I don't."
2012/01/24 12:05:40,"7th in a row!!! Great win at Minnesota, great effort from our bench, Pattrick, Goran, everybody. Now we going back home for 3 games #rockets"
2012/01/24 12:07:11,"Séptima victoria, contra Minnesota de visitante. Gran aporte desde el banco, Pattrick and Goran sobre todo, ahora 3 en casa. #rockets."
2012/01/25 07:54:33,"Guys, I got tickets for tomorrow's game to giveaway, stay tune. // Tengo entradas para sortear para el partido de mañana, estén atentos."
2012/02/04 07:22:18,"Buen partido (e importante para nosotros) hoy vs. Phoenix, el último antes de irnos de gira(6 partidos). Vamos en directo para Arg. #nbapass"
2012/02/07 13:19:45,#rednation show some love to @adrien4 he wants more followers and today he deserve it. Come on! Follow him! #rockets
2012/02/07 13:18:07,"Gran victoria de visitante, la necesitabamos, ahora para Portland"
2012/02/07 13:16:01,That was a great win on the road against a very good team. Wasn't pretty but I take it. No to Portland
2012/02/07 13:16:41,*now to Portland
2012/02/12 03:46:14,"Felicidades a todo el equipo Argentino de Copa Davis,  triunfazo. Esta vez los partidos y la diferencia horaria no me dejaron verlo, lástima"
2012/02/14 01:34:23,"Dura derrota ayer en San Francisco, jugaron mejor que nosotros y además nos mataron a triples. Ahora nos vamos para Memphis, y vuelta a casa"
2012/02/14 01:35:41,"Tough lost last night, they played better and killed us from behind the arc. Now Memphis and the back home again. Veeeery long trip."
2012/03/13 00:06:03,Feliz 1er aniversario a @Culturizando. Vale la pena seguirlos. Sigan así.
2012/03/21 12:58:39,¡Qué buen partido que le ganamos a los Lakers! La cancha explotaba. Parecía que se nos escapaba pero lo llevamos al final. Ahora Warriors
2012/03/21 12:57:10,What a great win! The TC was LOUD!... We need a good playoff push in this home stand #RedNation
2012/03/23 12:57:52,"Another good win, this time vs. Warrios at home. Now Dallas come to the Toyota Center on saturday, huge game for us. #rednation #rockets"
2012/03/23 12:56:50,"Otra buena victoria, esta vez vs. Warriors en casa. El sabado viene Dallas al Toyota Center, gran partido."
2012/04/07 14:24:53,Very fun game to play! Huge win on the road vs LA. Now we need to back it up in Sacramento Sunday. #rednation the play off are 1 step closer
2012/04/08 04:45:56,"Wow... Increíble partido, terrible ambiente. Pude ver el último punto por la compu. Si yo llego a jugar 5 horas me desintegro. Notable"
2012/04/08 04:25:24,"Y sí, efectivamente... Aterricé y el partido sigue, ¡vamos muchachos!"
2012/04/08 03:03:03,¿A Quien puedo seguir para el minuto a minuto en Parque Roca?
2012/04/07 14:31:23,"Gran partido ganamos hoy, los play off están un pasito más cerca. Ahora hay que confirmar la victoria de hoy el domingo en Sacramento."
2012/04/07 08:05:08,Largo viaje por autopista para llegar al Stapples y jugar con los Lakers. A las 23:30 h de Argentina por #nbapass. Lindo partido para jugar
2012/04/08 03:16:18,Este avión que está a punto de despegar y el partido no se termina. ¡Me quiero matar!
2012/04/09 03:40:26,What a Game in NY! Novak's 3 was in!  How did that ball didn't go in?! Amazing
2012/04/09 03:39:23,"¡Qué partidazo NY-Chi! El triple de Novak estaba adentro, ¿Cómo salió esa pelota?"
2012/04/21 11:34:36,"Miro el partido con una mezcla de envidia (sana), admiración e incredulidad. A San Antonio da gusto verlo... Cuando no juegan vs. Rockets."
2012/04/21 23:40:10,Tengo intriga por ver como se ve Madrid-Barsa por #DIRECTV3D . Nunca vi un partido en 3D.
2012/11/01 14:11:05,"It felt nice to play my 1th game as a Suns, too bad we couldn't come up with the W.I like our team,we just need to do some work. #All4Orange"
2012/11/01 14:13:03,"Me sentí bien en mi primer partido en PHX. Lástima que se nos escapó. Me gusta el equipo, pero nos falta rodaje. A ver que pasa el viernes."
2012/11/03 14:10:47,"First win... Feels good. Hopefully the first of many. Nice team effort, next time we got to close it better. #All4Orange"
2012/11/09 05:29:03,Look what I just got... COD!! Oh yeah!/ acabo de recibir el nuevo Call of Duty!! Yes sir! http://t.co/K5qedGiX
2012/11/09 11:49:19,Que lindo partido el de Boca-Lanús. Terrible @fedevanlacke. No voy a poder ver la semi mañana. Voy a tener que grabar. Una lástima
2012/11/16 04:04:55,"Desde hoy,quiero que a In'te le vaya bien.No soy hincha y hasta hoy ni me importaba, pero tengo q apoyar a Cantero aunque sea simbólicamente"
2012/11/16 04:15:49,"Quizás, con un poco de suerte y muchos tipos como Cantero, dentro de varios años pueda llevar a mis hijos a la cancha a pasar un lindo día."
2012/12/08 10:49:25,Thanks to @SkylandersGame for sending me a copy of the game. My kids love it!
2013/02/08 04:12:23,¿Quién me pasa un link para ver el final de Barsa-Madrid?
2013/02/08 04:22:39,"Ahí lo estoy viendo, muchas gracias a todos los que respondieron."
2013/03/15 01:48:31,"It was very special to be back in Houston. I cant say enough, thanks to all the fans and to the front office for the video. Great memories!"
2013/10/29 23:09:34,"Ya está todo listo, arranca la temporada por fin. Orlando en casa esta noche. Estoy ansioso..."
2013/10/29 23:08:30,"Shootaround it's over, there is nothing left to to but play. The regular season it's about to start.  GameTime."
2013/11/19 09:40:28,Llegó a mi casa mi quinto hijo// my fifth son... http://t.co/rwrfuEZSiE
2013/11/22 07:30:55,"Paul mirá al banco antes de que el tiro entre. Yo llego a intentar eso, me tropiezo y me fracturo la cadera. https://t.co/csWqOmhVEr"
2013/12/21 15:03:19,"Me levanto para entrar en el 1er cuarto y el estadio se cae abajo 'wow, la debo estar rompiendo' pensé.  Pero no, Danny Granger estaba atrás"
2013/12/21 15:01:06,"As I walked to the table to check in, I heard a loud cheer and thought 'wow, I must to be playing great'. I didn't see Danny behind me."
2014/01/07 04:14:59,-39° de sensación térmica.  Me parece que suspendo el asadito que tenía planeado... http://t.co/dYSXkDIGLu
2014/01/15 23:42:51,"Por lo mucho que me reí viendo este video, mi compi @stephensonlance se ganó mi voto. Lance Stephenson #NBAballot
https://t.co/PUkuzjxns1"
2014/03/08 15:36:34,What a difficult stretch we are going tru. But we will get over it. This team is very good. We will get it right.
2015/02/07 23:56:33,"Gracias por todo, René. Lo voy a extrañar. 
""no se puede hacer más lento""
http://t.co/aVmIg79ivd"
2015/03/06 00:35:51,"Mi reacción inicial fue reírme,  después pensé que debo tener unas cuantas parecidas, por eso solo lo comparto. :) 
https://t.co/H4FssvQc1D"
2015/03/20 07:58:12,Let's do this! http://t.co/vIp2YndNIW
2015/12/22 06:11:43,Thanks a lot to my friends of @DisneyOnIce for invite my kids to their show in Toronto.  They loved it.
2016/01/18 07:25:00,DeMar DeRozan #NBAVote
